{
  "$schema": "http://json-schema.org/draft-07/schema#",
  "title": "Species Profile",
  "description": "Schema for aquarium species profiles",
  "type": "object",
  "required": ["id", "commonName", "scientificName", "description"],
  "properties": {
    "id": {
      "type": "string",
      "description": "Unique identifier for the species, used in URLs"
    },
    "commonName": {
      "type": "string",
      "description": "Common name of the species"
    },
    "synonyms": {
      "type": "array",
      "items": {
        "type": "string"
      },
      "description": "Alternative common names"
    },
    "scientificName": {
      "type": "string",
      "description": "Scientific (Latin) name of the species"
    },
    "taxonomy": {
      "type": "object",
      "description": "Taxonomic classification of the species",
      "properties": {
        "kingdom": { "type": "string" },
        "phylum": { "type": "string" },
        "class": { "type": "string" },
        "order": { "type": "string" },
        "family": { "type": "string" },
        "genus": { "type": "string" },
        "species": { "type": ["string", "null"] }
      }
    },
    "conservationStatus": {
      "type": "object",
      "properties": {
        "iucn": { "type": "string" },
        "cites": { "type": "string" }
      }
    },
    "distribution": {
      "type": "object",
      "properties": {
        "range": {
          "type": "array",
          "items": { "type": "string" }
        },
        "coordinates": {
          "type": "object",
          "properties": {
            "lat": { "type": "number" },
            "lng": { "type": "number" }
          }
        },
        "mapImage": { "type": "string" }
      }
    },
    "description": {
      "type": "string",
      "description": "Description of the species"
    },
    "size": {
      "type": "object",
      "properties": {
        "max": {
          "type": "object",
          "properties": {
            "value": { "type": "number" },
            "unit": { "type": "string" }
          },
          "required": ["value", "unit"]
        },
        "average": {
          "type": "object",
          "properties": {
            "value": { "type": "number" },
            "unit": { "type": "string" }
          },
          "required": ["value", "unit"]
        }
      }
    },
    "lifespan": {
      "type": "object",
      "properties": {
        "typical": {
          "type": "object",
          "properties": {
            "value": { "type": "number" },
            "unit": { "type": "string" }
          },
          "required": ["value", "unit"]
        },
        "max": {
          "type": "object",
          "properties": {
            "value": { "type": "number" },
            "unit": { "type": "string" }
          },
          "required": ["value", "unit"]
        }
      }
    },
    "sexualDimorphism": { "type": "string" },
    "habitat": {
      "type": "object",
      "properties": {
        "type": {
          "type": "array",
          "items": { "type": "string" }
        },
        "depth": {
          "type": "object",
          "properties": {
            "min": { "type": "number" },
            "max": { "type": "number" },
            "unit": { "type": "string" }
          }
        },
        "substrate": {
          "type": "array",
          "items": { "type": "string" }
        }
      }
    },
    "waterParameters": {
      "type": "object",
      "properties": {
        "temperature": {
          "type": "object",
          "properties": {
            "min": { "type": "number" },
            "max": { "type": "number" },
            "unit": { "type": "string" }
          }
        },
        "pH": {
          "type": "object",
          "properties": {
            "min": { "type": "number" },
            "max": { "type": "number" }
          }
        },
        "hardness": {
          "type": "object",
          "properties": {
            "min": { "type": "number" },
            "max": { "type": "number" },
            "unit": { "type": "string" }
          }
        },
        "salinity": {
          "type": "object",
          "properties": {
            "min": { "type": "number" },
            "max": { "type": "number" },
            "unit": { "type": "string" }
          }
        },
        "ammonia": {
          "type": "object",
          "properties": {
            "max": { "type": "number" },
            "unit": { "type": "string" }
          }
        },
        "nitrite": {
          "type": "object",
          "properties": {
            "max": { "type": "number" },
            "unit": { "type": "string" }
          }
        },
        "nitrate": {
          "type": "object",
          "properties": {
            "max": { "type": "number" },
            "unit": { "type": "string" }
          }
        }
      }
    },
    "tankRequirements": {
      "type": "object",
      "properties": {
        "minimumVolume": {
          "type": "object",
          "properties": {
            "value": { "type": "number" },
            "unit": { "type": "string" }
          }
        },
        "recommendedVolume": {
          "type": "object",
          "properties": {
            "value": { "type": "number" },
            "unit": { "type": "string" }
          }
        },
        "shape": { "type": "string" },
        "aquascape": {
          "type": "array",
          "items": { "type": "string" }
        },
        "waterFlow": { "type": "string" },
        "filtration": { "type": "string" },
        "lighting": {
          "type": "object",
          "properties": {
            "type": { "type": "string" },
            "photoperiod": {
              "type": "object",
              "properties": {
                "min": { "type": "number" },
                "max": { "type": "number" },
                "unit": { "type": "string" }
              }
            }
          }
        }
      }
    },
    "diet": {
      "type": "object",
      "properties": {
        "type": {
          "type": "array",
          "items": { "type": "string" }
        },
        "staple": {
          "type": "array",
          "items": { "type": "string" }
        },
        "supplements": {
          "type": "array",
          "items": { "type": "string" }
        },
        "feedingFrequency": {
          "type": "object",
          "properties": {
            "timesPerDay": { "type": "number" },
            "notes": { "type": "string" }
          }
        }
      }
    },
    "behavior": {
      "type": "object",
      "properties": {
        "temperament": { "type": "string" },
        "social": { "type": "string" },
        "territorial": { "type": "string" },
        "activity": { "type": "string" }
      }
    },
    "compatibility": {
      "type": "object",
      "properties": {
        "suitableTankmates": {
          "type": "array",
          "items": { "type": "string" }
        },
        "avoid": {
          "type": "array",
          "items": { "type": "string" }
        }
      }
    },
    "breeding": {
      "type": "object",
      "properties": {
        "type": { "type": "string" },
        "spawningBehavior": { "type": "string" },
        "difficulty": { "type": "string" },
        "eggCare": { "type": "string" },
        "notes": { "type": "string" }
      }
    },
    "health": {
      "type": "object",
      "properties": {
        "commonDiseases": {
          "type": "array",
          "items": { "type": "string" }
        },
        "commonIssues": {
          "type": "array",
          "items": { "type": "string" }
        },
        "treatments": {
          "type": "array",
          "items": { "type": "string" }
        },
        "prevention": { "type": "string" }
      }
    },
    "careLevel": { "type": "string" },
    "price": {
      "type": "object",
      "properties": {
        "range": {
          "type": "object",
          "properties": {
            "min": { "type": "number" },
            "max": { "type": "number" },
            "currency": { "type": "string" }
          }
        },
        "availability": { "type": "string" }
      }
    },
    "gallery": {
      "type": "array",
      "items": { "type": "string" }
    },
    "tags": {
      "type": "array",
      "items": { "type": "string" }
    },
    "references": {
      "type": "array",
      "items": {
        "type": "object",
        "properties": {
          "title": { "type": "string" },
          "url": { "type": "string", "format": "uri" },
          "accessed": { "type": "string", "format": "date" }
        },
        "required": ["title", "url"]
      }
    }
  }
} 