{
  "id": "clownfish",
  "commonName": "Clownfish",             
  "synonyms": ["Anemonefish"],          
  "scientificName": "Amphiprioninae",     
  "taxonomy": {
    "kingdom": "Animalia",
    "phylum": "Chordata",
    "class": "Actinopterygii",
    "order": "Perciformes",
    "family": "Pomacentridae",
    "genus": "Amphiprion",
    "species": null                       
  },
  "conservationStatus": {
    "iucn": "Least Concern",              
    "cites": "Appendix II"               
  },
  "distribution": {
    "range": ["Red Sea", "Western Pacific"], 
    "coordinates": {                      
      "lat": 10.0,
      "lng": 45.0
    },
    "mapImage": "/img/map/clownfish-range.jpg"
  },
  "description": "A small, vividly colored marine fish that is known for its symbiotic relationship with sea anemones. Clownfish are protected from the stinging tentacles of anemones due to a layer of mucus they develop that provides immunity. They are popular in marine aquariums due to their bright colors and interesting behavior.",
  "size": {
    "max": {
      "value": 10,
      "unit": "cm"
    },
    "average": {
      "value": 8,
      "unit": "cm"
    }
  },
  "lifespan": {
    "typical": {
      "value": 6,
      "unit": "years"
    },
    "max": {
      "value": 10,
      "unit": "years"
    }
  },
  "sexualDimorphism": "Females larger and more colorful", 
  "habitat": {
    "type": ["Coral reef", "Lagoon"],
    "depth": {
      "min": 1,
      "max": 15,
      "unit": "m"
    },
    "substrate": ["Live rock", "Anemone hosts"]
  },
  "waterParameters": {
    "temperature": {
      "min": 24,
      "max": 27,
      "unit": "°C"
    },
    "pH": {
      "min": 7.8,
      "max": 8.4
    },
    "hardness": {
      "min": 8,
      "max": 12,
      "unit": "dGH"
    },
    "salinity": {
      "min": 1.020,
      "max": 1.026,
      "unit": "sg"
    },
    "ammonia": {
      "max": 0,
      "unit": "ppm"
    },
    "nitrite": {
      "max": 0,
      "unit": "ppm"
    },
    "nitrate": {
      "max": 20,
      "unit": "ppm"
    }
  },
  "tankRequirements": {
    "minimumVolume": {
      "value": 75,
      "unit": "L"
    },
    "recommendedVolume": {
      "value": 100,
      "unit": "L"
    },
    "shape": "Standard rectangle",
    "aquascape": ["Live rock", "Caves", "Host anemone"],
    "waterFlow": "Moderate",
    "filtration": "Protein skimmer + biological filter",
    "lighting": {
      "type": "Full‐spectrum LED",
      "photoperiod": {
        "min": 8,
        "max": 10,
        "unit": "hours/day"
      }
    }
  },
  "diet": {
    "type": ["Omnivore"],
    "staple": ["Flake food", "Pellets"],
    "supplements": ["Frozen mysis shrimp", "Brine shrimp", "Algae wafers"],
    "feedingFrequency": {
      "timesPerDay": 2,
      "notes": "Small portions to avoid overfeeding."
    }
  },
  "behavior": {
    "temperament": "Peaceful except among conspecifics",
    "social": "Pairs or small groups; hierarchical",
    "territorial": "Mildly"
  },
  "compatibility": {
    "suitableTankmates": ["Gobies", "Blennies", "Tangs"],
    "avoid": ["Large aggressive species", "Anemone predators"]
  },
  "breeding": {
    "type": "Egg layer",
    "spawningBehavior": "Forms monogamous pairs; lays eggs on flat surfaces",
    "difficulty": "Moderate",
    "eggCare": "Adults guard the nest; remove fry to rearing tank",
    "notes": "Require anemone hosts for natural pairing."
  },
  "health": {
    "commonDiseases": ["Brooklynella", "Marine ich"],
    "treatments": ["Freshwater dips", "Medication per vet guidance"]
  },
  "careLevel": "Moderate",                
  "price": {
    "range": {
      "min": 15,
      "max": 30,
      "currency": "USD"
    },
    "availability": "Common"               
  },
  "gallery": [
    "/img/species/clownfish-1.jpg",
    "/img/species/clownfish-2.jpg"
  ],
  "tags": ["reef‐safe", "marine", "community"],
  "references": [
    {
      "title": "Clownfish Care Guide",
      "url": "https://example.org/clownfish-care",
      "accessed": "2025-04-27"
    }
  ]
} 